{
  "v": 1,
  "revision": 1,
  "updated_at": 1,
  "settings": {
    "enabled": true,
    "mode": "private_only",
    "agent": {
      "vpn_url": "https://10.144.144.1",
      "public_url": null
    }
  },
  "agent_enabled": true,
  "platform_server_url": "https://fleet.example.com",
  "legacy_devices": 0,
  "suggested_agent": null,
  "device_count": 2,
  "pending_agents": 1
}
